{
  "$schema": "https://json-schema.org/draft/2020-12/schema",
  "$id": "https://provenance.dev/asr/0.3.0/schemas/topics.schema.json",
  "title": "ASR Topic Taxonomy (topics.json)",
  "description": "The registry's hand-authored topic vocabulary. Every topic a profile claims in scope.topics MUST exist here (unknown_topic); the taxonomy is per-registry by design — energy topics and mycology topics do not belong in one flat list — and each registry maps its topics onto consumer vocabularies (e.g. the pi-forge router) in its export crosswalk, not here. Unlike the manifest this file is NOT regenerable: it encodes human curation, including ties from topics back to the objectives that motivated them.",
  "type": "object",
  "properties": {
    "asr_spec_version": { "type": "string" },
    "registry_id": { "type": "string", "pattern": "^reg-[0-9a-f]{12}$" },
    "topics": {
      "type": "array",
      "items": {
        "type": "object",
        "properties": {
          "id": { "type": "string", "pattern": "^[a-z0-9]+(-[a-z0-9]+)*$", "description": "Kebab-case topic slug; the value profiles reference." },
          "label": { "type": "string" },
          "description": { "type": "string" },
          "parent": { "type": ["string", "null"], "pattern": "^[a-z0-9]+(-[a-z0-9]+)*$", "description": "Optional parent topic id for shallow hierarchy; null for top level." },
          "objective": { "type": "string", "description": "Optional tie back to the research objective, contract clause, or question that motivated this topic (generalizes a relevance_objective column)." },
          "ext": { "type": "object", "additionalProperties": true }
        },
        "required": ["id", "label"],
        "additionalProperties": true
      }
    },
    "provenance": { "$ref": "provenance-stamp.schema.json" },
    "notes": { "type": "string" }
  },
  "required": ["asr_spec_version", "topics", "provenance"],
  "additionalProperties": true
}
