{
  "asr_spec_version": "0.2.0",
  "topics": [
    {
      "id": "general",
      "label": "General",
      "description": "",
      "parent": null
    }
  ],
  "provenance": {
    "produced_by": {
      "tool": "authority-fixtures",
      "tool_version": "0.2.0",
      "model": null,
      "method": "fixture",
      "person": null
    },
    "created_at": "2026-08-17T12:00:00.000Z",
    "modified_at": null
  },
  "notes": ""
}
