{
  "asr_spec_version": "0.4.0",
  "topics": [
    {
      "id": "seasons-and-programs",
      "label": "Seasons and programs",
      "description": "Concerts, dates, venues, works, conductors and soloists.",
      "parent": null
    },
    {
      "id": "organization",
      "label": "Organization",
      "description": "Mission, history, leadership, musicians, education programs.",
      "parent": null
    },
    {
      "id": "press-and-news",
      "label": "Press and news",
      "description": "The orchestra's own press releases and announcements.",
      "parent": null
    }
  ],
  "provenance": {
    "produced_by": {
      "tool": "authority",
      "tool_version": "0.4.0",
      "model": null,
      "method": "tool",
      "person": null
    },
    "created_at": "2026-09-30T00:22:00.128Z",
    "modified_at": null
  },
  "notes": "Hand-authored taxonomy: profiles may only claim topics listed here (spec/01.5)."
}
