{
  "asr_spec_version": "0.1.0",
  "topics": [
    {
      "id": "energy-policy",
      "label": "Energy policy",
      "description": "Statutes, rulemakings, agency programs.",
      "parent": null,
      "objective": "FORGE Task 2.3 policy landscape"
    },
    {
      "id": "codes-standards",
      "label": "Codes & standards",
      "description": "Building energy codes, appliance standards.",
      "parent": "energy-policy"
    },
    {
      "id": "building-decarbonization",
      "label": "Building decarbonization",
      "description": "Electrification of residential buildings.",
      "parent": null,
      "objective": "FORGE Task 2.2 residential electrification"
    },
    {
      "id": "heat-pumps",
      "label": "Heat pumps",
      "description": "Space and water heating technology and market.",
      "parent": "building-decarbonization",
      "objective": "FORGE Task 2.4 industry & technology trends"
    },
    {
      "id": "program-evaluation",
      "label": "Program evaluation",
      "description": "Measurement & evaluation of efficiency programs.",
      "parent": null
    },
    {
      "id": "incentives",
      "label": "Incentives",
      "description": "Rebates, tax credits, incentive databases.",
      "parent": null
    },
    {
      "id": "energy-data",
      "label": "Energy data",
      "description": "Statistical series and primary datasets.",
      "parent": null
    }
  ],
  "provenance": {
    "produced_by": {
      "tool": "authority-seed",
      "tool_version": "0.1.0",
      "model": "claude-fable-5",
      "method": "model",
      "person": null
    },
    "created_at": "2026-08-18T02:43:59.974Z",
    "modified_at": null
  },
  "notes": ""
}
