{
  "asr_spec_version": "0.1.0",
  "topics": [
    {
      "id": "flora",
      "label": "Flora",
      "description": "Plants.",
      "parent": null
    },
    {
      "id": "fauna",
      "label": "Fauna",
      "description": "Animals.",
      "parent": null
    },
    {
      "id": "fungi",
      "label": "Fungi",
      "description": "",
      "parent": null
    },
    {
      "id": "birds",
      "label": "Birds",
      "description": "",
      "parent": "fauna"
    },
    {
      "id": "occurrence-data",
      "label": "Occurrence data",
      "description": "Observation and specimen records.",
      "parent": null
    },
    {
      "id": "taxonomy",
      "label": "Taxonomy & nomenclature",
      "description": "Names, synonymy, classification.",
      "parent": null
    },
    {
      "id": "bioacoustics",
      "label": "Bioacoustics",
      "description": "Wildlife sound.",
      "parent": null
    }
  ],
  "provenance": {
    "produced_by": {
      "tool": "authority-seed",
      "tool_version": "0.1.0",
      "model": "claude-fable-5",
      "method": "model",
      "person": null
    },
    "created_at": "2026-08-18T02:43:59.974Z",
    "modified_at": null
  },
  "notes": ""
}
