{
  "asr_spec_version": "0.4.0",
  "topics": [
    {
      "id": "program-notes",
      "label": "Program and liner notes",
      "description": "Notes on specific works by presenters and labels.",
      "parent": null
    },
    {
      "id": "composers-and-works",
      "label": "Composers and works",
      "description": "Biography, history and analysis of composers and pieces.",
      "parent": null
    },
    {
      "id": "performers",
      "label": "Performers",
      "description": "Conductors, soloists and ensembles.",
      "parent": null
    },
    {
      "id": "reviews-and-criticism",
      "label": "Reviews and criticism",
      "description": "Reviews of performances and recordings.",
      "parent": null
    },
    {
      "id": "essays-and-features",
      "label": "Essays and features",
      "description": "Longer writing for general readers.",
      "parent": null
    },
    {
      "id": "local-arts-press",
      "label": "Local arts press",
      "description": "Bay Area arts news, previews and listings.",
      "parent": null
    }
  ],
  "provenance": {
    "produced_by": {
      "tool": "authority",
      "tool_version": "0.4.0",
      "model": null,
      "method": "tool",
      "person": null
    },
    "created_at": "2026-09-30T00:22:00.038Z",
    "modified_at": null
  },
  "notes": "Hand-authored taxonomy: profiles may only claim topics listed here (spec/01.5)."
}
