{
  "asr_spec_version": "0.3.0",
  "topics": [
    {
      "id": "epistemology",
      "label": "Epistemology",
      "description": "",
      "parent": null
    },
    {
      "id": "ethics",
      "label": "Ethics",
      "description": "",
      "parent": null
    },
    {
      "id": "metaphysics",
      "label": "Metaphysics",
      "description": "",
      "parent": null
    },
    {
      "id": "logic",
      "label": "Logic",
      "description": "",
      "parent": null
    },
    {
      "id": "history-of-philosophy",
      "label": "History of philosophy",
      "description": "",
      "parent": null
    },
    {
      "id": "philosophy-of-science",
      "label": "Philosophy of science",
      "description": "",
      "parent": null
    },
    {
      "id": "primary-texts",
      "label": "Primary texts",
      "description": "Public-domain source texts.",
      "parent": null
    }
  ],
  "provenance": {
    "produced_by": {
      "tool": "authority-seed",
      "tool_version": "0.1.0",
      "model": "claude-fable-5",
      "method": "model",
      "person": null
    },
    "created_at": "2026-08-18T02:43:59.974Z",
    "modified_at": null
  },
  "notes": ""
}
